{
  "record_type": "failed-equivalence-decision",
  "identity": "sun",
  "candidate_sha256": "3b5a9e9aa90a42e5632996219771f7a6bd1f5d92cadf52ee734797c55fc10620",
  "source_path": "assets/canonical-glyphs/v1/masters/assets/planet-glyphs/sun.svg",
  "approving_authority": "Repository owner via explicit Codex task instruction",
  "approval_date": "2026-08-06",
  "baseline_commit": "e518a7c6fc4e36dbac22efc234d32028616ae8e6",
  "reference_package_hash": "e42113ce38f58af0eee2650043a3575c392f16061996bb4b7cf76982f9061ae7",
  "decision_type": "approve-named-baked-candidate-with-documented-raster-difference",
  "notes": "Approval applies only to the named baked candidate bytes and exact SHA-256. Rounded, truncated, optimized, regenerated, and manually altered variants are not approved.",
  "documented_raster_difference": {
    "size": 1000,
    "density": 1,
    "differing_pixels": 57,
    "bounding_box": {
      "x": 335,
      "y": 335,
      "width": 331,
      "height": 332
    },
    "cause": "transformed outer-circle stroke boundary",
    "finding": "The 57 pixels are on the transformed outer-circle stroke boundary at 1000/DPR 1. Six-significant-digit stroke truncation removes them, but changes the proportional value and is rejected."
  },
  "no_geometry_value_changed_to_force_equivalence": true,
  "geometry_confirmation": {
    "geometry": true,
    "whitespace": true,
    "scale": true,
    "position": true,
    "proportions": true,
    "strokes": true
  },
  "no_fallback_or_runtime_fitting_authorized": true,
  "signature": {
    "algorithm": "user-instruction-sha256-attestation-v1",
    "key_id": "codex-attachment:ed36daf6-737e-4cb5-98ab-f82d67a5838c",
    "signed_payload_sha256": "c79d4aeff08ce527513c58e3a1b1af377a125a05c87b74d2e4cd1bf2bcfbb09e",
    "value": "2565e3f19b9d9c37a24f4311cb3835806bf5376d7c0e11279a354cdb8c83d7c1"
  }
}
