{
  "record_type": "failed-equivalence-decision",
  "identity": "pluto",
  "candidate_sha256": "f464449635a1430a4ac0bf9b6c38c6f9f4f9bab38e2ee0ec9ae295d591181661",
  "source_path": "assets/canonical-glyphs/v1/masters/assets/planet-glyphs/pluto.svg",
  "approving_authority": "Repository owner via explicit Codex task instruction",
  "approval_date": "2026-08-06",
  "baseline_commit": "e518a7c6fc4e36dbac22efc234d32028616ae8e6",
  "reference_package_hash": "e42113ce38f58af0eee2650043a3575c392f16061996bb4b7cf76982f9061ae7",
  "decision_type": "approve-named-baked-candidate-with-documented-raster-difference",
  "notes": "Approval applies only to the named baked candidate bytes and exact SHA-256. Rounded, truncated, optimized, regenerated, and manually altered variants are not approved.",
  "documented_raster_difference": {
    "size": 1000,
    "density": 2,
    "differing_pixels": 10,
    "bounding_box": {
      "x": 1236,
      "y": 910,
      "width": 51,
      "height": 38
    },
    "cause": "circle/path stroke boundary",
    "finding": "The 10 pixels occur at 1000/DPR 2 on the scaled circle/path stroke boundary. Seven-significant-digit circle or stroke truncation removes them, but changes geometry/paint and is rejected."
  },
  "no_geometry_value_changed_to_force_equivalence": true,
  "geometry_confirmation": {
    "geometry": true,
    "whitespace": true,
    "scale": true,
    "position": true,
    "proportions": true,
    "strokes": true
  },
  "no_fallback_or_runtime_fitting_authorized": true,
  "signature": {
    "algorithm": "user-instruction-sha256-attestation-v1",
    "key_id": "codex-attachment:ed36daf6-737e-4cb5-98ab-f82d67a5838c",
    "signed_payload_sha256": "936fa0cae52c3adce37d9b4c1536c8f00e371b9c8a10b390d2df5a37a0db589d",
    "value": "2565e3f19b9d9c37a24f4311cb3835806bf5376d7c0e11279a354cdb8c83d7c1"
  }
}
