{
  "record_type": "failed-equivalence-decision",
  "identity": "virgo",
  "candidate_sha256": "46f1136ce90c1fa8b89b78fbb3ab61a286183ddc57207c227e4a8262df3a7ed6",
  "source_path": "assets/canonical-glyphs/v1/masters/assets/zodiac-glyphs/virgo.svg",
  "approving_authority": "Repository owner via explicit Codex task instruction",
  "approval_date": "2026-08-06",
  "baseline_commit": "e518a7c6fc4e36dbac22efc234d32028616ae8e6",
  "reference_package_hash": "e42113ce38f58af0eee2650043a3575c392f16061996bb4b7cf76982f9061ae7",
  "decision_type": "approve-named-baked-candidate-with-documented-raster-difference",
  "notes": "Approval applies only to the named baked candidate bytes and exact SHA-256. Rounded, truncated, optimized, regenerated, and manually altered variants are not approved.",
  "documented_raster_difference": {
    "size": 400,
    "density": 2,
    "differing_pixels": 3,
    "bounding_box": {
      "x": 488,
      "y": 304,
      "width": 3,
      "height": 3
    },
    "cause": "filled-path edge",
    "finding": "Three pixels occur at 400/DPR 2 on the filled path edge. Float32 serialization merely moves the mismatch to another scale; no faithful serialization is zero at all six checks."
  },
  "no_geometry_value_changed_to_force_equivalence": true,
  "geometry_confirmation": {
    "geometry": true,
    "whitespace": true,
    "scale": true,
    "position": true,
    "proportions": true,
    "strokes": true
  },
  "no_fallback_or_runtime_fitting_authorized": true,
  "signature": {
    "algorithm": "user-instruction-sha256-attestation-v1",
    "key_id": "codex-attachment:ed36daf6-737e-4cb5-98ab-f82d67a5838c",
    "signed_payload_sha256": "b9461d0c8a96c666c53ddc0542377453214b0b1ed5207977b2fffd9d544fdaf6",
    "value": "2565e3f19b9d9c37a24f4311cb3835806bf5376d7c0e11279a354cdb8c83d7c1"
  }
}
