{
  "record_type": "failed-equivalence-decision",
  "identity": "jupiter",
  "candidate_sha256": "c2b4f5741619ab5b90671bf60a63f0a8b239df45b1a02debc3f03d1405d0065f",
  "source_path": "assets/canonical-glyphs/v1/masters/assets/planet-glyphs/jupiter.svg",
  "approving_authority": "Repository owner via explicit Codex task instruction",
  "approval_date": "2026-08-06",
  "baseline_commit": "e518a7c6fc4e36dbac22efc234d32028616ae8e6",
  "reference_package_hash": "e42113ce38f58af0eee2650043a3575c392f16061996bb4b7cf76982f9061ae7",
  "decision_type": "approve-named-baked-candidate-with-documented-raster-difference",
  "notes": "Approval applies only to the named baked candidate bytes and exact SHA-256. Rounded, truncated, optimized, regenerated, and manually altered variants are not approved.",
  "documented_raster_difference": {
    "size": 1000,
    "density": 1,
    "differing_pixels": 25,
    "bounding_box": {
      "x": 343,
      "y": 426,
      "width": 26,
      "height": 22
    },
    "cause": "transformed-path antialiasing",
    "finding": "The 25 pixels occur on transformed path antialiasing at 1000/DPR 1. Float32 path-coordinate truncation removes them, but is a geometry precision reduction and is rejected."
  },
  "no_geometry_value_changed_to_force_equivalence": true,
  "geometry_confirmation": {
    "geometry": true,
    "whitespace": true,
    "scale": true,
    "position": true,
    "proportions": true,
    "strokes": true
  },
  "no_fallback_or_runtime_fitting_authorized": true,
  "signature": {
    "algorithm": "user-instruction-sha256-attestation-v1",
    "key_id": "codex-attachment:ed36daf6-737e-4cb5-98ab-f82d67a5838c",
    "signed_payload_sha256": "0f3205a19c5f98c56f12a0319a61e39afb45e04e6c6eac2df359450d2dfee2dc",
    "value": "2565e3f19b9d9c37a24f4311cb3835806bf5376d7c0e11279a354cdb8c83d7c1"
  }
}
