{
  "record_type": "failed-equivalence-decision",
  "identity": "capricorn",
  "candidate_sha256": "586bdfd10ebbdef3fd97bcc1cba94c9662c8bc5cf95454c90e3374fbe468d27b",
  "source_path": "assets/canonical-glyphs/v1/masters/assets/zodiac-glyphs/capricorn.svg",
  "approving_authority": "Repository owner via explicit Codex task instruction",
  "approval_date": "2026-08-06",
  "baseline_commit": "e518a7c6fc4e36dbac22efc234d32028616ae8e6",
  "reference_package_hash": "e42113ce38f58af0eee2650043a3575c392f16061996bb4b7cf76982f9061ae7",
  "decision_type": "approve-named-baked-candidate-with-documented-raster-difference",
  "notes": "Approval applies only to the named baked candidate bytes and exact SHA-256. Rounded, truncated, optimized, regenerated, and manually altered variants are not approved.",
  "documented_raster_difference": {
    "size": 1000,
    "density": 1,
    "differing_pixels": 3,
    "bounding_box": {
      "x": 514,
      "y": 585,
      "width": 3,
      "height": 5
    },
    "cause": "filled-path edge",
    "finding": "Three pixels occur at 1000/DPR 1 on the filled path edge. Seven-significant-digit truncation removes those pixels but creates 59 at 1000/DPR 2, so it is rejected."
  },
  "no_geometry_value_changed_to_force_equivalence": true,
  "geometry_confirmation": {
    "geometry": true,
    "whitespace": true,
    "scale": true,
    "position": true,
    "proportions": true,
    "strokes": true
  },
  "no_fallback_or_runtime_fitting_authorized": true,
  "signature": {
    "algorithm": "user-instruction-sha256-attestation-v1",
    "key_id": "codex-attachment:ed36daf6-737e-4cb5-98ab-f82d67a5838c",
    "signed_payload_sha256": "4956ee6d48a7739c7c1720eb4594075f03e4adfc7b5436ed68d8390efcad66fa",
    "value": "2565e3f19b9d9c37a24f4311cb3835806bf5376d7c0e11279a354cdb8c83d7c1"
  }
}
